[
  {
    "rule_id": "jupiter_conjunct_natal_sun_fame",
    "name": "Jupiter Conjunct Natal Sun — Fame Activation Transit",
    "description": "Transit Jupiter conjunct natal Sun is the single strongest transit for fame activation. Expands public visibility, authority, and recognition from superiors.",
    "source_text": {"work_name": "Phaladeepika", "chapter": "25", "verse": "8", "page": null, "quote": "When Jupiter transits over the natal Sun, the native receives honor from the king, gains authority, and becomes famous in the land.", "translation": null},
    "domain": "status",
    "event_family": "fame_and_public_recognition",
    "event_subtype": ["public_honor", "authority_recognition", "government_award"],
    "rule_type": "transit",
    "status": "active",
    "priority": 95,
    "polarity": "supportive",
    "timing_band": "medium",
    "conditions": {"all_of": ["Transit Jupiter is within 5 degrees of natal Sun longitude"], "any_of": [], "none_of": []},
    "signals": {"dasha": [], "transit": ["Jupiter_conjunct_natal_Sun"], "houses": [], "planets": ["Jupiter", "Sun"], "nakshatra": [], "d9": [], "sensitive_points": ["natal_Sun_longitude"]},
    "interpretation": {"meaning": "Jupiter (expansion, dharma, grace) passing over natal Sun (self, fame, authority) activates the fame potential. Awards, promotions, public honors, government recognition typically manifest.", "mode": "political_fame", "quality": "stable", "scale": "national", "confidence": 0.92},
    "window": {"broad_window_days": 90, "exact_window_days": 21, "confidence_decay_days": 30},
    "weights": {"dasha_weight": 0.0, "transit_weight": 0.95, "fast_trigger_weight": 0.0, "classical_weight": 0.0},
    "outputs": {"symbolic_label": "jupiter_sun_fame_activation", "likelihood_band": "very_high", "timing_band": "narrow", "recommended_action": "accept_award_seek_promotion"},
    "metadata": {"notes": "The single most reliable fame transit. 12-year cycle. Each occurrence marks a potential fame peak."}
  },
  {
    "rule_id": "jupiter_return_natal_position",
    "name": "Jupiter Return — Dharma Recognition Cycle",
    "description": "Jupiter returning to its natal position (every ~12 years) activates wisdom-fame, spiritual recognition, and dharmic honor. Amplified if natal Jupiter is strong.",
    "source_text": {"work_name": "Brihat Jataka", "chapter": "24", "verse": "12", "page": null, "quote": "When Jupiter returns to its natal position, the fruits of past dharmic actions ripen, bringing recognition, honor, and expansion of influence.", "translation": null},
    "domain": "status",
    "event_family": "fame_and_public_recognition",
    "event_subtype": ["spiritual_fame", "wisdom_recognition", "dharmic_honor"],
    "rule_type": "transit",
    "status": "active",
    "priority": 90,
    "polarity": "supportive",
    "timing_band": "medium",
    "conditions": {"all_of": ["Transit Jupiter is within 5 degrees of natal Jupiter longitude"], "any_of": [], "none_of": []},
    "signals": {"dasha": [], "transit": ["Jupiter_return"], "houses": [], "planets": ["Jupiter"], "nakshatra": [], "d9": [], "sensitive_points": ["natal_Jupiter_longitude"]},
    "interpretation": {"meaning": "Jupiter Return marks a 12-year dharmic cycle. Past wisdom, teaching, and righteous action bear fruit as public recognition, spiritual authority, or institutional honor.", "mode": "spiritual_fame", "quality": "stable", "scale": "national", "confidence": 0.88},
    "window": {"broad_window_days": 90, "exact_window_days": 21, "confidence_decay_days": 30},
    "weights": {"dasha_weight": 0.0, "transit_weight": 0.9, "fast_trigger_weight": 0.0, "classical_weight": 0.0},
    "outputs": {"symbolic_label": "jupiter_return_dharma_fame", "likelihood_band": "high", "timing_band": "narrow", "recommended_action": "publish_teach_accept_honors"},
    "metadata": {"notes": "Occurs at ages ~12, 24, 36, 48, 60. Each return amplifies if natal Jupiter is well-placed."}
  },
  {
    "rule_id": "abhishek_tara_28th_transit_fame",
    "name": "Abhishek Tara (28th Nakshatra) Transit — Coronation Window",
    "description": "When slow planets (Jupiter/Saturn) transit the 28th nakshatra from birth Moon (Abhishek Tara = coronation star), a fame/recognition window activates.",
    "source_text": {"work_name": "Muhurta Chintamani", "chapter": "4", "verse": "22", "page": null, "quote": "The 28th nakshatra from birth star is Abhishek Tara, the star of coronation and anointing. Transits over this point bring public elevation.", "translation": null},
    "domain": "status",
    "event_family": "fame_and_public_recognition",
    "event_subtype": ["coronation", "elevation", "public_anointing"],
    "rule_type": "transit",
    "status": "active",
    "priority": 88,
    "polarity": "supportive",
    "timing_band": "medium",
    "conditions": {"all_of": ["Transit Jupiter or Saturn is in the 28th nakshatra from birth Moon nakshatra"], "any_of": [], "none_of": []},
    "signals": {"dasha": [], "transit": ["abhishek_tara_28th"], "houses": [], "planets": ["Jupiter", "Saturn"], "nakshatra": ["28th_from_birth_moon"], "d9": [], "sensitive_points": []},
    "interpretation": {"meaning": "Abhishek Tara (28th nakshatra from Moon) is literally the 'coronation star'. Slow planet transits here create windows for public elevation, awards, titles, and formal recognition.", "mode": "political_fame", "quality": "stable", "scale": "national", "confidence": 0.85},
    "window": {"broad_window_days": 120, "exact_window_days": 30, "confidence_decay_days": 45},
    "weights": {"dasha_weight": 0.0, "transit_weight": 0.88, "fast_trigger_weight": 0.0, "classical_weight": 0.0},
    "outputs": {"symbolic_label": "abhishek_tara_coronation_window", "likelihood_band": "high", "timing_band": "narrow", "recommended_action": "accept_titles_awards_honors"},
    "metadata": {"notes": "Abhishek = coronation/anointing. This tara system is specific to Vedic electional astrology applied to natal charts."}
  },
  {
    "rule_id": "benefics_transit_10th_house_fame",
    "name": "Benefics Transit 10th House — Public Action Window",
    "description": "When multiple natural benefics (Jupiter, Venus, Mercury) transit the 10th house from lagna simultaneously, a strong public visibility and recognition window opens.",
    "source_text": {"work_name": "Saravali", "chapter": "35", "verse": "18", "page": null, "quote": "When benefic planets transit the 10th house, the native gains in profession, receives public honor, and their good deeds become known to all.", "translation": null},
    "domain": "status",
    "event_family": "fame_and_public_recognition",
    "event_subtype": ["career_fame", "public_visibility", "professional_honor"],
    "rule_type": "transit",
    "status": "active",
    "priority": 82,
    "polarity": "supportive",
    "timing_band": "medium",
    "conditions": {"all_of": ["At least 2 natural benefics (Jupiter, Venus, Mercury, Moon) are transiting the 10th house from Lagna"], "any_of": [], "none_of": []},
    "signals": {"dasha": [], "transit": ["benefics_in_10th"], "houses": ["10"], "planets": ["Jupiter", "Venus", "Mercury", "Moon"], "nakshatra": [], "d9": [], "sensitive_points": []},
    "interpretation": {"meaning": "Multiple benefics in the 10th house create a powerful positive glow on public reputation. Professional honors, media attention, and career-based fame manifest.", "mode": "political_fame", "quality": "stable", "scale": "local", "confidence": 0.8},
    "window": {"broad_window_days": 60, "exact_window_days": 14, "confidence_decay_days": 21},
    "weights": {"dasha_weight": 0.0, "transit_weight": 0.82, "fast_trigger_weight": 0.0, "classical_weight": 0.0},
    "outputs": {"symbolic_label": "benefics_10th_public_visibility", "likelihood_band": "moderate", "timing_band": "narrow", "recommended_action": "launch_public_initiatives"},
    "metadata": {"notes": "Strongest when Jupiter is one of the benefics. Venus alone gives artistic/beauty recognition."}
  }
]
